{
  "$schema": "http://json-schema.org/draft-07/schema#",
  "$id": "https://custom-agents.local/schemas/taxonomy.schema.json",
  "title": "taxonomy.json — configuracion de knowledge-services por proyecto consumidor",
  "description": "Documenta el contrato que valida `agent-kits/shared/knowledge-schema.py` (validador stdlib, sin dependencias — ADR-018). No se interpreta con una libreria jsonschema: es la referencia legible de las mismas reglas que el validador aplica a mano. version 1.",
  "$comment": "Vocabulario del frontmatter de una ENTRADA (no de este `taxonomy.json`, que solo describe categorias/backends/routing): bajo `docs/knowledge/approved/<folder>/`, el campo obligatorio `estado` DEBE valer el token en espanol `aprobado` — coherente con el resto de tokens parseados en espanol del plugin (`docs/CONVENTIONS.md`), aunque las carpetas del arbol sean inglesas (`approved/`, `candidates/{pending,needs_changes,rejected}/`). Lo hace cumplir `knowledge-index.py` (gap 34, revision de dos lentes); `knowledge-curator` (T-04) usa el MISMO token al aprobar un candidato.",
  "type": "object",
  "required": [
    "version",
    "categories"
  ],
  "additionalProperties": true,
  "properties": {
    "version": {
      "type": "integer",
      "minimum": 1,
      "description": "Version del esquema de este fichero. El plugin acepta N y N-1 (ADR-018 punto 8)."
    },
    "id_prefix": {
      "type": "string",
      "description": "Prefijo de `knowledge_id` del proyecto (p. ej. `mr` -> `mr.pattern.fast-curve`). Sin este campo, el prefijo default es el slug del directorio del proyecto."
    },
    "utility_scoring": {
      "type": "boolean",
      "default": false,
      "description": "Opt-in. Si es true, el candidato lleva un desglose 0-10 que SOLO ordena la cola de revision; nunca decide `approved`/`rejected` por si mismo (CA-10)."
    },
    "evidence_levels": {
      "type": "array",
      "items": {
        "type": "string"
      },
      "minItems": 1,
      "description": "Escalera de evidencia. Sin este campo, el default del plugin aplica: observation -> single_case -> validated_case -> multiple_validated_cases -> human_confirmed_rule."
    },
    "denylist": {
      "type": "array",
      "items": {
        "type": "string"
      },
      "description": "Lista negra de memoria activa, AMPLIABLE sobre el default del plugin (chain-of-thought, conversacion cruda, TODO:, planes/progreso, logs completos, salidas enormes, codigo duplicado, errores triviales, intentos sin aprendizaje, hipotesis como hechos, opiniones, redundancias)."
    },
    "backends": {
      "type": "object",
      "description": "Cada clave es un id de backend declarado. `routing` (por categoria) SOLO puede citar ids declarados aqui; un id no declarado es error de validacion (fail-closed, CA-11).",
      "additionalProperties": {
        "type": "object",
        "required": [
          "type"
        ],
        "properties": {
          "type": {
            "type": "string",
            "description": "Adaptador que implementa el contrato `health · plan · apply · verify · rebuild · revoke` (skills/knowledge-services/backends/<type>.py). p. ej. `markdown-export` (Kwipu) o `graphiti`."
          },
          "enabled": {
            "type": "boolean",
            "default": false
          },
          "config": {
            "type": "object",
            "description": "Configuracion propia del adaptador (p. ej. `export_dir`, `health.url`, `health.timeout_ms` para `markdown-export`). Para `type: \"graphiti\"` (graphiti-memory ADR-018/T-01, enmienda 2026-09-19 de design.md/T-01-fix1 y T-01-fix2): cualquier clave fuera de las listadas aqui (o dentro de `provider`/`router`/`health`) es error de validacion, no se ignora en silencio. `mode` (`off|shadow|read`, default `shadow`), `endpoint` (URL `/mcp`; local/privado -mismo criterio que el adaptador Kwipu, incluye `host.docker.internal` y sufijos `.test`/`.local`/`.internal`- salvo `allow_remote: true`, leido como booleano estricto), `group_id` (SIN default cableado: derivado por CUALQUIER backend cuyo `type` sea `graphiti` -no solo la clave literal `graphiti`- con el slug Unicode del directorio del proyecto -conserva acentos/CJK, a diferencia del slug ASCII de `id_prefix`-; no puede ser cadena vacia, y con el backend habilitado es obligatorio declararlo a mano si el directorio no aporta ningun caracter alfanumerico -nunca cae al mismo `\"ca\"` fijo que `id_prefix`, para no fusionar por accidente proyectos distintos en el mismo grupo remoto-), `provider` ({`llm`: `ollama|openai|anthropic|none` -obligatorio con el backend habilitado-, `model` -OBLIGATORIO si `llm` no es `none` (gap #37: sin este campo, `graphiti_providers.py` caia a un modelo CABLEADO en el codigo, contra CA-09 \"ningun modelo ni endpoint tiene default cableado\")-, `embedder`, `embedder_model`, `base_url`, `api_key_env` — SOLO el nombre de la variable de entorno, nunca la credencial), `entity_map` ({categoria: tipo declarado por el SERVIDOR Graphiti, cadena NO vacia; default `Document`}), `relations` (lista ampliable sobre `SUPPORTED_BY`/`SUPERSEDES`/`CONTRADICTS`, sin cadenas vacias), `router.intents` ({intent: booleano}) y `router.default` (RESERVADA: se valida y se conserva, pero ningun codigo la lee — CA-12 exige que una consulta que el router no puede servir caiga al camino LOCAL, no a otro backend por defecto; gap #108), `telemetria` (booleano), `timeout_ms` (entero finito, mayor que 0; default 3000, timeout de la llamada MCP en si), `concurrency` (entero mayor o igual que 1; default 1, mismo limite que `SEMAPHORE_LIMIT` del stack de referencia), `episode_body_max_kb` (entero finito, mayor que 0; opcional, default 512 KiB aplicado por `graphiti.py` si no se declara — tope del tamano de `episode_body` que viaja a `add_memory`; por encima se trunca con un marcador y `apply()` devuelve un aviso, gap #64), `max_respuesta_kb` (entero mayor que 0; opcional, default 8192 KiB = 8 MiB - tope DURO de lectura de CADA respuesta MCP, leida por trozos; pasarse es un error explicito, nunca un MemoryError, gap #70), `max_episodes` (entero mayor que 0; opcional, default 5000 - tope de la ventana de `get_episodes` que barre `verify()`, gap #70) y `health` ({url -mismo guardarrail de red que `endpoint`-, timeout_ms -entero finito, mayor que 0-}). `endpoint` y `health.url` NUNCA pueden llevar credenciales embebidas (userinfo `usuario:token@host`, gap #43) — usa `provider.api_key_env`; y el criterio local/privado normaliza SIEMPRE literales IPv4-mapeados en IPv6 (`::ffff:169.254.169.254`, etc., gap #53) antes de clasificarlos, para que no se cuelen como IPv6 \"normal\", y rechaza SIEMPRE -tambien con `allow_remote: true`- link-local/metadatos de nube, direcciones no especificadas y los prefijos de transicion IPv6 6to4 (`2002::/16`) y Teredo (`2001:0::/32`), que envuelven una IPv4 arbitraria y CPython clasifica como privados (gaps #71/#75). Con el backend habilitado (`enabled: true`), `endpoint`, `provider.llm` y `mode` son obligatorios. Validado a mano en `agent-kits/shared/knowledge-schema.py::_validar_backend_graphiti`.\n`transition_relations`: episode|triplet (default episode). Episode records confirm version-scoped SUPERSEDES provenance without direct Entity writes. Triplet is an explicit operator opt-in requiring verified server write isolation by group; a group_id argument alone does not prove physical routing. Validated by knowledge-schema.py. `transition_excluded_entity_types`: optional list of up to 128 printable custom server type names (1-256 characters, no surrounding whitespace). Control markers exclude standard Entity plus the declared names and use empty previous_episode_uuids. Declare all custom server types; unknown names may fail asynchronously. Regular knowledge ingestion is unchanged."
          }
        },
        "allOf": [
          {
            "if": {
              "properties": {
                "type": {
                  "const": "markdown-export"
                }
              },
              "required": [
                "type"
              ]
            },
            "then": {
              "properties": {
                "config": {
                  "$ref": "#/definitions/documentalConfig"
                }
              }
            }
          }
        ]
      }
    },
    "categories": {
      "type": "array",
      "minItems": 1,
      "items": {
        "type": "object",
        "required": [
          "key",
          "folder",
          "min_evidence"
        ],
        "properties": {
          "key": {
            "type": "string",
            "description": "Clave de la categoria (p. ej. DECISION, PATTERN, GOTCHA, LESSON, o cualquier dominio propio del proyecto)."
          },
          "folder": {
            "type": "string",
            "description": "Carpeta bajo `docs/knowledge/approved/` donde viven las entradas aprobadas de esta categoria."
          },
          "min_evidence": {
            "type": "string",
            "description": "Nivel minimo exigido de `evidence_levels` para que un candidato de esta categoria pueda aprobarse."
          },
          "routing": {
            "type": "object",
            "description": "Por backend declarado en `backends`: `true` (exporta entero), `false` (no exporta) o `\"summary\"` (solo el resumen). Sin `routing` declarado, la categoria NO exporta a ningun backend (fail-closed, CA-09/CA-11).",
            "additionalProperties": {
              "oneOf": [
                {
                  "type": "boolean"
                },
                {
                  "const": "summary"
                }
              ]
            }
          }
        }
      }
    }
  },
  "definitions": {
    "documentalConfig": {
      "type": "object",
      "additionalProperties": true,
      "description": "Publicación existente compatible. Lectura opcional: backend enabled true, read.enabled true e intent explícito autorizado. El contexto interno procede del canon local, nunca de JSON del consumidor. router.default se valida pero no enruta.",
      "properties": {
        "read": {
          "type": "object",
          "additionalProperties": false,
          "properties": {
            "enabled": {
              "type": "boolean",
              "default": false
            },
            "timeout_ms": {
              "type": "integer",
              "minimum": 1,
              "maximum": 30000,
              "default": 5000
            },
            "max_request_bytes": {
              "type": "integer",
              "minimum": 1,
              "maximum": 65536,
              "default": 8192
            },
            "max_answer_chars": {
              "type": "integer",
              "minimum": 1,
              "maximum": 65536,
              "default": 4096
            },
            "max_source_nodes": {
              "type": "integer",
              "minimum": 1,
              "maximum": 1024,
              "default": 64
            },
            "max_response_bytes": {
              "type": "integer",
              "minimum": 1,
              "maximum": 2097152,
              "default": 262144
            },
            "max_snapshot_bytes": {
              "type": "integer",
              "minimum": 1,
              "maximum": 2097152,
              "default": 2097152
            }
          }
        },
        "router": {
          "type": "object",
          "additionalProperties": false,
          "properties": {
            "default": {
              "type": "string"
            },
            "intents": {
              "type": "object",
              "additionalProperties": false,
              "patternProperties": {
                "^[a-z][a-z0-9_-]*$": {
                  "type": "boolean"
                }
              }
            }
          }
        }
      }
    }
  }
}
